{
  "$schema": "https://json-schema.org/draft/2020-12/schema",
  "$id": "urn:dsh-community-market:schema:catalog-provider-page:1.0.0",
  "title": "DSH Community Market standard provider page",
  "description": "The untrusted page JSON returned by one standard HTTPS catalog endpoint. Only schemaVersion, items, and page are required. A page may contain at most 200 items and must also respect the effective requested or declared default limit. Host-observed provenance is intentionally absent and is injected only after validation.",
  "type": "object",
  "additionalProperties": false,
  "required": ["schemaVersion", "items", "page"],
  "properties": {
    "schemaVersion": {
      "const": "1.0.0"
    },
    "generatedAt": {
      "type": "string",
      "format": "date-time"
    },
    "revision": {
      "type": "string",
      "minLength": 1,
      "maxLength": 160
    },
    "items": {
      "type": "array",
      "maxItems": 200,
      "items": {
        "$ref": "#/$defs/item"
      }
    },
    "page": {
      "$ref": "#/$defs/page"
    }
  },
  "$defs": {
    "identifier": {
      "type": "string",
      "minLength": 1,
      "maxLength": 160,
      "pattern": "^[A-Za-z0-9][A-Za-z0-9._:/@+-]*$"
    },
    "httpsUri": {
      "type": "string",
      "format": "uri",
      "maxLength": 2048,
      "pattern": "^https://(?![^/?#]*@)(?![^/?#]*:)[^#]+$"
    },
    "plainText": {
      "type": "string",
      "pattern": "^[^\\u0000-\\u001F\\u007F-\\u009F\\u202A-\\u202E\\u2066-\\u2069]*$"
    },
    "mediaAlt": {
      "allOf": [
        {
          "$ref": "#/$defs/plainText"
        },
        {
          "type": "string",
          "minLength": 1,
          "maxLength": 240
        }
      ]
    },
    "remoteIconCandidate": {
      "type": "object",
      "description": "A provider-declared remote plugin-icon candidate. The URL must share the final provider-page response origin. The Host resolves and validates it before it can enter a normalized snapshot; the Renderer never receives this URL.",
      "additionalProperties": false,
      "required": ["url"],
      "properties": {
        "url": {
          "$ref": "#/$defs/httpsUri"
        },
        "alt": {
          "$ref": "#/$defs/mediaAlt"
        }
      }
    },
    "media": {
      "type": "object",
      "description": "Optional provider-declared plugin media. In v1, only a direct plugin icon is standardized.",
      "additionalProperties": false,
      "required": ["icon"],
      "properties": {
        "icon": {
          "$ref": "#/$defs/remoteIconCandidate"
        }
      }
    },
    "page": {
      "type": "object",
      "description": "Use an empty object when there is no next page. nextCursor is opaque and belongs only to this source and effective query.",
      "additionalProperties": false,
      "properties": {
        "nextCursor": {
          "type": "string",
          "minLength": 1,
          "maxLength": 2048
        },
        "total": {
          "type": "integer",
          "minimum": 0
        }
      }
    },
    "repository": {
      "type": "object",
      "additionalProperties": false,
      "required": ["url"],
      "properties": {
        "url": {
          "$ref": "#/$defs/httpsUri"
        },
        "subdirectory": {
          "type": "string",
          "minLength": 1,
          "maxLength": 240,
          "pattern": "^(?!/)(?!.*(?:^|/)\\.\\.(?:/|$))[^\\\\]+$"
        }
      }
    },
    "installSource": {
      "type": "object",
      "additionalProperties": false,
      "required": ["kind", "commit"],
      "properties": {
        "kind": {
          "const": "github"
        },
        "commit": {
          "type": "string",
          "pattern": "^[0-9a-f]{40}$"
        }
      }
    },
    "package": {
      "type": "object",
      "additionalProperties": false,
      "required": ["registry", "name"],
      "properties": {
        "registry": {
          "const": "npm"
        },
        "name": {
          "type": "string",
          "minLength": 1,
          "maxLength": 214,
          "pattern": "^(?:@[a-z0-9][a-z0-9._-]*/)?[a-z0-9][a-z0-9._-]*$"
        }
      }
    },
    "publisher": {
      "type": "object",
      "additionalProperties": false,
      "required": ["name"],
      "properties": {
        "name": {
          "allOf": [
            {
              "$ref": "#/$defs/plainText"
            },
            {
              "type": "string",
              "minLength": 1,
              "maxLength": 120
            }
          ]
        },
        "url": {
          "$ref": "#/$defs/httpsUri"
        }
      }
    },
    "capabilityList": {
      "type": "array",
      "maxItems": 64,
      "uniqueItems": true,
      "items": {
        "type": "string",
        "minLength": 1,
        "maxLength": 96,
        "pattern": "^[a-z][a-z0-9-]*(?:\\.[a-z][a-z0-9-]*)+$"
      }
    },
    "categoryId": {
      "type": "string",
      "minLength": 1,
      "maxLength": 64,
      "pattern": "^[a-z0-9][a-z0-9._:-]*$"
    },
    "capabilities": {
      "type": "object",
      "additionalProperties": false,
      "properties": {
        "required": {
          "$ref": "#/$defs/capabilityList"
        },
        "optional": {
          "$ref": "#/$defs/capabilityList"
        }
      }
    },
    "compatibility": {
      "type": "object",
      "additionalProperties": false,
      "properties": {
        "apiVersion": {
          "type": "string",
          "minLength": 1,
          "maxLength": 64
        },
        "hosts": {
          "type": "array",
          "maxItems": 32,
          "uniqueItems": true,
          "items": {
            "type": "string",
            "minLength": 1,
            "maxLength": 96
          }
        }
      }
    },
    "item": {
      "type": "object",
      "additionalProperties": false,
      "required": ["id", "name", "displayName", "summary"],
      "properties": {
        "id": {
          "$ref": "#/$defs/identifier"
        },
        "name": {
          "allOf": [
            {
              "$ref": "#/$defs/plainText"
            },
            {
              "type": "string",
              "minLength": 1,
              "maxLength": 160
            }
          ]
        },
        "displayName": {
          "allOf": [
            {
              "$ref": "#/$defs/plainText"
            },
            {
              "type": "string",
              "minLength": 1,
              "maxLength": 120
            }
          ]
        },
        "summary": {
          "allOf": [
            {
              "$ref": "#/$defs/plainText"
            },
            {
              "type": "string",
              "minLength": 1,
              "maxLength": 1000
            }
          ]
        },
        "description": {
          "allOf": [
            {
              "$ref": "#/$defs/plainText"
            },
            {
              "type": "string",
              "maxLength": 5000
            }
          ]
        },
        "homepage": {
          "$ref": "#/$defs/httpsUri"
        },
        "latestVersion": {
          "type": "string",
          "minLength": 1,
          "maxLength": 64
        },
        "license": {
          "type": "string",
          "minLength": 1,
          "maxLength": 80
        },
        "categories": {
          "type": "array",
          "maxItems": 32,
          "uniqueItems": true,
          "items": {
            "$ref": "#/$defs/categoryId"
          }
        },
        "keywords": {
          "type": "array",
          "maxItems": 64,
          "uniqueItems": true,
          "items": {
            "type": "string",
            "minLength": 1,
            "maxLength": 64
          }
        },
        "repository": {
          "$ref": "#/$defs/repository"
        },
        "installSource": {
          "$ref": "#/$defs/installSource"
        },
        "package": {
          "$ref": "#/$defs/package"
        },
        "publisher": {
          "$ref": "#/$defs/publisher"
        },
        "media": {
          "$ref": "#/$defs/media"
        },
        "capabilities": {
          "$ref": "#/$defs/capabilities"
        },
        "compatibility": {
          "$ref": "#/$defs/compatibility"
        },
        "updatedAt": {
          "type": "string",
          "format": "date-time"
        }
      },
      "anyOf": [
        {
          "properties": {
            "repository": true
          },
          "required": ["repository"]
        },
        {
          "properties": {
            "package": true
          },
          "required": ["package"]
        }
      ]
    }
  }
}
