{
  "schemaVersion": "1.0.0",
  "generatedAt": "2026-08-17T08:00:00Z",
  "revision": "2026-08-17T08:00:00Z",
  "items": [
    {
      "id": "better-sidebar",
      "name": "dsh-plugin-better-sidebar",
      "displayName": "Better Sidebar",
      "summary": "Adds a configurable sidebar panel through declared UI capabilities.",
      "homepage": "https://github.com/example/dsh-plugin-better-sidebar",
      "latestVersion": "1.2.0",
      "license": "MIT",
      "categories": ["interface"],
      "keywords": ["sidebar", "panel"],
      "repository": {
        "url": "https://github.com/example/dsh-plugin-better-sidebar"
      },
      "package": {
        "registry": "npm",
        "name": "dsh-plugin-better-sidebar"
      },
      "publisher": {
        "name": "Example Maintainers",
        "url": "https://github.com/example"
      },
      "media": {
        "icon": {
          "url": "https://plugins.example.org/assets/better-sidebar.png",
          "alt": "Better Sidebar plugin icon"
        }
      },
      "capabilities": {
        "required": ["ui.panel"],
        "optional": ["storage.local"]
      },
      "compatibility": {
        "apiVersion": "1.x",
        "hosts": ["gui>=2.0"]
      },
      "updatedAt": "2026-08-16T10:30:00Z"
    }
  ],
  "page": {
    "nextCursor": "page_2",
    "total": 42
  }
}
